{
  "case_id": "f17-fault-02-after-event-before-command",
  "classification": "contract_characterized",
  "clock_utc": "2026-09-01T12:00:00Z",
  "expected_violations": [
    "confirmed_event_has_no_recoverable_command"
  ],
  "incident_id": "F17",
  "initial_state": {},
  "manychat_fixture": "fixtures/manychat/hostel-reservation.json",
  "safety": {
    "database": false,
    "message_delivery": false,
    "network": false,
    "provider_reads": false,
    "provider_writes": false
  },
  "schema_version": 1,
  "source_refs": [
    {
      "evidence": "Ledger e request síncrono definem janelas de claim e resultado.",
      "path": "services/side_effect_ledger.py",
      "symbols": [
        "SideEffectLedger"
      ]
    },
    {
      "evidence": "Persistência e outbox pública possuem fronteiras separadas no request.",
      "path": "app.py",
      "symbols": [
        "_process_event"
      ]
    }
  ],
  "title": "Fault boundary contract: after_event_before_command",
  "trace": [
    {
      "event_id": "evt-hostel-request",
      "kind": "inbound",
      "seq": 1
    },
    {
      "draft_version": "draft-alpha",
      "kind": "summary_presented",
      "seq": 2
    },
    {
      "event_id": "evt-hostel-confirm",
      "kind": "inbound",
      "seq": 3
    },
    {
      "decision": "accepted",
      "draft_version": "draft-alpha",
      "kind": "confirmation_received",
      "seq": 4
    },
    {
      "command_recoverable": false,
      "confirmation_event_persisted": true,
      "fault_point": "after_event_before_command",
      "kind": "crash",
      "seq": 5
    }
  ]
}
